
*** Running vivado
    with args -log UART_Loopback_Top.vdi -applog -m64 -product Vivado -messageDb vivado.pb -mode batch -source UART_Loopback_Top.tcl -notrace



****** Vivado v2024.2 (64-bit)
  **** SW Build 5239630 on Fri Nov 08 22:35:27 MST 2024
  **** IP Build 5239520 on Sun Nov 10 16:12:51 MST 2024
  **** SharedData Build 5239561 on Fri Nov 08 14:39:27 MST 2024
  **** Start of session at: Sun Jan 18 15:56:43 2026
    ** Copyright 1986-2022 Xilinx, Inc. All Rights Reserved.
    ** Copyright 2022-2024 Advanced Micro Devices, Inc. All Rights Reserved.

source UART_Loopback_Top.tcl -notrace
Command: link_design -top UART_Loopback_Top -part xc7a100tcsg324-1
Design is defaulting to srcset: sources_1
Design is defaulting to constrset: constrs_1
INFO: [Device 21-403] Loading part xc7a100tcsg324-1
Netlist sorting complete. Time (s): cpu = 00:00:00 ; elapsed = 00:00:00.001 . Memory (MB): peak = 696.738 ; gain = 0.000
INFO: [Netlist 29-17] Analyzing 36 Unisim elements for replacement
INFO: [Netlist 29-28] Unisim Transformation completed in 0 CPU seconds
INFO: [Project 1-479] Netlist was created with Vivado 2024.2
INFO: [Project 1-570] Preparing netlist for logic optimization
Parsing XDC File [D:/Downloads/project_BLE/project_BLE.srcs/constrs_1/imports/lab1/Nexys-A7-100T-Master.xdc]
WARNING: [Vivado 12-584] No ports matched 'o_led'. [D:/Downloads/project_BLE/project_BLE.srcs/constrs_1/imports/lab1/Nexys-A7-100T-Master.xdc:30]
CRITICAL WARNING: [Common 17-55] 'set_property' expects at least one object. [D:/Downloads/project_BLE/project_BLE.srcs/constrs_1/imports/lab1/Nexys-A7-100T-Master.xdc:30]
Resolution: If [get_<value>] was used to populate the object, check to make sure this command returns at least one valid object.
WARNING: [Vivado 12-584] No ports matched 'seg(0)'. [D:/Downloads/project_BLE/project_BLE.srcs/constrs_1/imports/lab1/Nexys-A7-100T-Master.xdc:56]
CRITICAL WARNING: [Common 17-55] 'set_property' expects at least one object. [D:/Downloads/project_BLE/project_BLE.srcs/constrs_1/imports/lab1/Nexys-A7-100T-Master.xdc:56]
Resolution: If [get_<value>] was used to populate the object, check to make sure this command returns at least one valid object.
WARNING: [Vivado 12-584] No ports matched 'seg(1)'. [D:/Downloads/project_BLE/project_BLE.srcs/constrs_1/imports/lab1/Nexys-A7-100T-Master.xdc:57]
CRITICAL WARNING: [Common 17-55] 'set_property' expects at least one object. [D:/Downloads/project_BLE/project_BLE.srcs/constrs_1/imports/lab1/Nexys-A7-100T-Master.xdc:57]
Resolution: If [get_<value>] was used to populate the object, check to make sure this command returns at least one valid object.
WARNING: [Vivado 12-584] No ports matched 'seg(2)'. [D:/Downloads/project_BLE/project_BLE.srcs/constrs_1/imports/lab1/Nexys-A7-100T-Master.xdc:58]
CRITICAL WARNING: [Common 17-55] 'set_property' expects at least one object. [D:/Downloads/project_BLE/project_BLE.srcs/constrs_1/imports/lab1/Nexys-A7-100T-Master.xdc:58]
Resolution: If [get_<value>] was used to populate the object, check to make sure this command returns at least one valid object.
WARNING: [Vivado 12-584] No ports matched 'seg(3)'. [D:/Downloads/project_BLE/project_BLE.srcs/constrs_1/imports/lab1/Nexys-A7-100T-Master.xdc:59]
CRITICAL WARNING: [Common 17-55] 'set_property' expects at least one object. [D:/Downloads/project_BLE/project_BLE.srcs/constrs_1/imports/lab1/Nexys-A7-100T-Master.xdc:59]
Resolution: If [get_<value>] was used to populate the object, check to make sure this command returns at least one valid object.
WARNING: [Vivado 12-584] No ports matched 'seg(4)'. [D:/Downloads/project_BLE/project_BLE.srcs/constrs_1/imports/lab1/Nexys-A7-100T-Master.xdc:60]
CRITICAL WARNING: [Common 17-55] 'set_property' expects at least one object. [D:/Downloads/project_BLE/project_BLE.srcs/constrs_1/imports/lab1/Nexys-A7-100T-Master.xdc:60]
Resolution: If [get_<value>] was used to populate the object, check to make sure this command returns at least one valid object.
WARNING: [Vivado 12-584] No ports matched 'seg(5)'. [D:/Downloads/project_BLE/project_BLE.srcs/constrs_1/imports/lab1/Nexys-A7-100T-Master.xdc:61]
CRITICAL WARNING: [Common 17-55] 'set_property' expects at least one object. [D:/Downloads/project_BLE/project_BLE.srcs/constrs_1/imports/lab1/Nexys-A7-100T-Master.xdc:61]
Resolution: If [get_<value>] was used to populate the object, check to make sure this command returns at least one valid object.
WARNING: [Vivado 12-584] No ports matched 'seg(6)'. [D:/Downloads/project_BLE/project_BLE.srcs/constrs_1/imports/lab1/Nexys-A7-100T-Master.xdc:62]
CRITICAL WARNING: [Common 17-55] 'set_property' expects at least one object. [D:/Downloads/project_BLE/project_BLE.srcs/constrs_1/imports/lab1/Nexys-A7-100T-Master.xdc:62]
Resolution: If [get_<value>] was used to populate the object, check to make sure this command returns at least one valid object.
WARNING: [Vivado 12-584] No ports matched 'seg(7)'. [D:/Downloads/project_BLE/project_BLE.srcs/constrs_1/imports/lab1/Nexys-A7-100T-Master.xdc:63]
CRITICAL WARNING: [Common 17-55] 'set_property' expects at least one object. [D:/Downloads/project_BLE/project_BLE.srcs/constrs_1/imports/lab1/Nexys-A7-100T-Master.xdc:63]
Resolution: If [get_<value>] was used to populate the object, check to make sure this command returns at least one valid object.
WARNING: [Vivado 12-584] No ports matched 'AN[0]'. [D:/Downloads/project_BLE/project_BLE.srcs/constrs_1/imports/lab1/Nexys-A7-100T-Master.xdc:64]
CRITICAL WARNING: [Common 17-55] 'set_property' expects at least one object. [D:/Downloads/project_BLE/project_BLE.srcs/constrs_1/imports/lab1/Nexys-A7-100T-Master.xdc:64]
Resolution: If [get_<value>] was used to populate the object, check to make sure this command returns at least one valid object.
WARNING: [Vivado 12-584] No ports matched 'AN[1]'. [D:/Downloads/project_BLE/project_BLE.srcs/constrs_1/imports/lab1/Nexys-A7-100T-Master.xdc:65]
CRITICAL WARNING: [Common 17-55] 'set_property' expects at least one object. [D:/Downloads/project_BLE/project_BLE.srcs/constrs_1/imports/lab1/Nexys-A7-100T-Master.xdc:65]
Resolution: If [get_<value>] was used to populate the object, check to make sure this command returns at least one valid object.
WARNING: [Vivado 12-584] No ports matched 'AN[2]'. [D:/Downloads/project_BLE/project_BLE.srcs/constrs_1/imports/lab1/Nexys-A7-100T-Master.xdc:66]
CRITICAL WARNING: [Common 17-55] 'set_property' expects at least one object. [D:/Downloads/project_BLE/project_BLE.srcs/constrs_1/imports/lab1/Nexys-A7-100T-Master.xdc:66]
Resolution: If [get_<value>] was used to populate the object, check to make sure this command returns at least one valid object.
WARNING: [Vivado 12-584] No ports matched 'AN[3]'. [D:/Downloads/project_BLE/project_BLE.srcs/constrs_1/imports/lab1/Nexys-A7-100T-Master.xdc:67]
CRITICAL WARNING: [Common 17-55] 'set_property' expects at least one object. [D:/Downloads/project_BLE/project_BLE.srcs/constrs_1/imports/lab1/Nexys-A7-100T-Master.xdc:67]
Resolution: If [get_<value>] was used to populate the object, check to make sure this command returns at least one valid object.
WARNING: [Vivado 12-584] No ports matched 'AN[4]'. [D:/Downloads/project_BLE/project_BLE.srcs/constrs_1/imports/lab1/Nexys-A7-100T-Master.xdc:68]
CRITICAL WARNING: [Common 17-55] 'set_property' expects at least one object. [D:/Downloads/project_BLE/project_BLE.srcs/constrs_1/imports/lab1/Nexys-A7-100T-Master.xdc:68]
Resolution: If [get_<value>] was used to populate the object, check to make sure this command returns at least one valid object.
WARNING: [Vivado 12-584] No ports matched 'AN[5]'. [D:/Downloads/project_BLE/project_BLE.srcs/constrs_1/imports/lab1/Nexys-A7-100T-Master.xdc:69]
CRITICAL WARNING: [Common 17-55] 'set_property' expects at least one object. [D:/Downloads/project_BLE/project_BLE.srcs/constrs_1/imports/lab1/Nexys-A7-100T-Master.xdc:69]
Resolution: If [get_<value>] was used to populate the object, check to make sure this command returns at least one valid object.
WARNING: [Vivado 12-584] No ports matched 'AN[6]'. [D:/Downloads/project_BLE/project_BLE.srcs/constrs_1/imports/lab1/Nexys-A7-100T-Master.xdc:70]
CRITICAL WARNING: [Common 17-55] 'set_property' expects at least one object. [D:/Downloads/project_BLE/project_BLE.srcs/constrs_1/imports/lab1/Nexys-A7-100T-Master.xdc:70]
Resolution: If [get_<value>] was used to populate the object, check to make sure this command returns at least one valid object.
WARNING: [Vivado 12-584] No ports matched 'AN[7]'. [D:/Downloads/project_BLE/project_BLE.srcs/constrs_1/imports/lab1/Nexys-A7-100T-Master.xdc:71]
CRITICAL WARNING: [Common 17-55] 'set_property' expects at least one object. [D:/Downloads/project_BLE/project_BLE.srcs/constrs_1/imports/lab1/Nexys-A7-100T-Master.xdc:71]
Resolution: If [get_<value>] was used to populate the object, check to make sure this command returns at least one valid object.
WARNING: [Vivado 12-584] No ports matched 'JA[2]'. [D:/Downloads/project_BLE/project_BLE.srcs/constrs_1/imports/lab1/Nexys-A7-100T-Master.xdc:85]
CRITICAL WARNING: [Common 17-55] 'set_property' expects at least one object. [D:/Downloads/project_BLE/project_BLE.srcs/constrs_1/imports/lab1/Nexys-A7-100T-Master.xdc:85]
Resolution: If [get_<value>] was used to populate the object, check to make sure this command returns at least one valid object.
WARNING: [Vivado 12-584] No ports matched 'JA[7]'. [D:/Downloads/project_BLE/project_BLE.srcs/constrs_1/imports/lab1/Nexys-A7-100T-Master.xdc:88]
CRITICAL WARNING: [Common 17-55] 'set_property' expects at least one object. [D:/Downloads/project_BLE/project_BLE.srcs/constrs_1/imports/lab1/Nexys-A7-100T-Master.xdc:88]
Resolution: If [get_<value>] was used to populate the object, check to make sure this command returns at least one valid object.
WARNING: [Vivado 12-584] No ports matched 'JA[8]'. [D:/Downloads/project_BLE/project_BLE.srcs/constrs_1/imports/lab1/Nexys-A7-100T-Master.xdc:89]
CRITICAL WARNING: [Common 17-55] 'set_property' expects at least one object. [D:/Downloads/project_BLE/project_BLE.srcs/constrs_1/imports/lab1/Nexys-A7-100T-Master.xdc:89]
Resolution: If [get_<value>] was used to populate the object, check to make sure this command returns at least one valid object.
WARNING: [Vivado 12-584] No ports matched 'JA[9]'. [D:/Downloads/project_BLE/project_BLE.srcs/constrs_1/imports/lab1/Nexys-A7-100T-Master.xdc:90]
CRITICAL WARNING: [Common 17-55] 'set_property' expects at least one object. [D:/Downloads/project_BLE/project_BLE.srcs/constrs_1/imports/lab1/Nexys-A7-100T-Master.xdc:90]
Resolution: If [get_<value>] was used to populate the object, check to make sure this command returns at least one valid object.
Finished Parsing XDC File [D:/Downloads/project_BLE/project_BLE.srcs/constrs_1/imports/lab1/Nexys-A7-100T-Master.xdc]
INFO: [Opt 31-138] Pushed 0 inverter(s) to 0 load pin(s).
Netlist sorting complete. Time (s): cpu = 00:00:00 ; elapsed = 00:00:00 . Memory (MB): peak = 830.891 ; gain = 0.000
INFO: [Project 1-111] Unisim Transformation Summary:
  A total of 1 instances were transformed.
  IOBUF => IOBUF (IBUF, OBUFT): 1 instance 

7 Infos, 21 Warnings, 21 Critical Warnings and 0 Errors encountered.
link_design completed successfully
Command: opt_design
Attempting to get a license for feature 'Implementation' and/or device 'xc7a100t'
INFO: [Common 17-349] Got license for feature 'Implementation' and/or device 'xc7a100t'
Running DRC as a precondition to command opt_design

Starting DRC Task
INFO: [DRC 23-27] Running DRC with 2 threads
INFO: [Project 1-461] DRC finished with 0 Errors
INFO: [Project 1-462] Please refer to the DRC report (report_drc) for more information.

Time (s): cpu = 00:00:02 ; elapsed = 00:00:01 . Memory (MB): peak = 870.367 ; gain = 39.477

Starting Cache Timing Information Task
INFO: [Timing 38-35] Done setting XDC timing constraints.
Ending Cache Timing Information Task | Checksum: 26dd3c064

Time (s): cpu = 00:00:04 ; elapsed = 00:00:05 . Memory (MB): peak = 1419.242 ; gain = 548.875

Starting Logic Optimization Task

Phase 1 Initialization

Phase 1.1 Core Generation And Design Setup
Phase 1.1 Core Generation And Design Setup | Checksum: 26dd3c064

Time (s): cpu = 00:00:00 ; elapsed = 00:00:00.001 . Memory (MB): peak = 1822.742 ; gain = 0.000

Phase 1.2 Setup Constraints And Sort Netlist
Phase 1.2 Setup Constraints And Sort Netlist | Checksum: 26dd3c064

Time (s): cpu = 00:00:00 ; elapsed = 00:00:00.004 . Memory (MB): peak = 1822.742 ; gain = 0.000
Phase 1 Initialization | Checksum: 26dd3c064

Time (s): cpu = 00:00:00 ; elapsed = 00:00:00.004 . Memory (MB): peak = 1822.742 ; gain = 0.000

Phase 2 Timer Update And Timing Data Collection

Phase 2.1 Timer Update
Phase 2.1 Timer Update | Checksum: 26dd3c064

Time (s): cpu = 00:00:00 ; elapsed = 00:00:00.016 . Memory (MB): peak = 1822.742 ; gain = 0.000

Phase 2.2 Timing Data Collection
Phase 2.2 Timing Data Collection | Checksum: 26dd3c064

Time (s): cpu = 00:00:00 ; elapsed = 00:00:00.029 . Memory (MB): peak = 1822.742 ; gain = 0.000
Phase 2 Timer Update And Timing Data Collection | Checksum: 26dd3c064

Time (s): cpu = 00:00:00 ; elapsed = 00:00:00.029 . Memory (MB): peak = 1822.742 ; gain = 0.000

Phase 3 Retarget
INFO: [Opt 31-1851] Number of loadless carry chains removed were: 0
INFO: [Opt 31-1834] Total Chains To Be Transformed Were: 0 AND Number of Transformed insts Created are: 0
INFO: [Opt 31-1566] Pulled 1 inverters resulting in an inversion of 4 pins
INFO: [Opt 31-138] Pushed 0 inverter(s) to 0 load pin(s).
INFO: [Opt 31-49] Retargeted 0 cell(s).
Phase 3 Retarget | Checksum: 2eeb23e2d

Time (s): cpu = 00:00:00 ; elapsed = 00:00:00.047 . Memory (MB): peak = 1822.742 ; gain = 0.000
Retarget | Checksum: 2eeb23e2d
INFO: [Opt 31-389] Phase Retarget created 0 cells and removed 1 cells

Phase 4 Constant propagation
INFO: [Opt 31-138] Pushed 0 inverter(s) to 0 load pin(s).
Phase 4 Constant propagation | Checksum: 2eeb23e2d

Time (s): cpu = 00:00:00 ; elapsed = 00:00:00.051 . Memory (MB): peak = 1822.742 ; gain = 0.000
Constant propagation | Checksum: 2eeb23e2d
INFO: [Opt 31-389] Phase Constant propagation created 0 cells and removed 0 cells

Phase 5 Sweep
INFO: [Constraints 18-11670] Building netlist checker database with flags, 0x8
Done building netlist checker database: Time (s): cpu = 00:00:00 ; elapsed = 00:00:00 . Memory (MB): peak = 1822.742 ; gain = 0.000
Phase 5 Sweep | Checksum: 2555a44a5

Time (s): cpu = 00:00:00 ; elapsed = 00:00:00.057 . Memory (MB): peak = 1822.742 ; gain = 0.000
Sweep | Checksum: 2555a44a5
INFO: [Opt 31-389] Phase Sweep created 0 cells and removed 0 cells

Phase 6 BUFG optimization
Phase 6 BUFG optimization | Checksum: 2555a44a5

Time (s): cpu = 00:00:00 ; elapsed = 00:00:00.089 . Memory (MB): peak = 1822.742 ; gain = 0.000
BUFG optimization | Checksum: 2555a44a5
INFO: [Opt 31-662] Phase BUFG optimization created 0 cells of which 0 are BUFGs and removed 0 cells.

Phase 7 Shift Register Optimization
INFO: [Opt 31-1064] SRL Remap converted 0 SRLs to 0 registers and converted 0 registers of register chains to 0 SRLs
Phase 7 Shift Register Optimization | Checksum: 2555a44a5

Time (s): cpu = 00:00:00 ; elapsed = 00:00:00.091 . Memory (MB): peak = 1822.742 ; gain = 0.000
Shift Register Optimization | Checksum: 2555a44a5
INFO: [Opt 31-389] Phase Shift Register Optimization created 0 cells and removed 0 cells

Phase 8 Post Processing Netlist
Phase 8 Post Processing Netlist | Checksum: 2555a44a5

Time (s): cpu = 00:00:00 ; elapsed = 00:00:00.093 . Memory (MB): peak = 1822.742 ; gain = 0.000
Post Processing Netlist | Checksum: 2555a44a5
INFO: [Opt 31-389] Phase Post Processing Netlist created 0 cells and removed 0 cells

Phase 9 Finalization

Phase 9.1 Finalizing Design Cores and Updating Shapes
Phase 9.1 Finalizing Design Cores and Updating Shapes | Checksum: 24ddadb18

Time (s): cpu = 00:00:00 ; elapsed = 00:00:00.101 . Memory (MB): peak = 1822.742 ; gain = 0.000

Phase 9.2 Verifying Netlist Connectivity

Starting Connectivity Check Task

Time (s): cpu = 00:00:00 ; elapsed = 00:00:00.013 . Memory (MB): peak = 1822.742 ; gain = 0.000
Phase 9.2 Verifying Netlist Connectivity | Checksum: 24ddadb18

Time (s): cpu = 00:00:00 ; elapsed = 00:00:00.114 . Memory (MB): peak = 1822.742 ; gain = 0.000
Phase 9 Finalization | Checksum: 24ddadb18

Time (s): cpu = 00:00:00 ; elapsed = 00:00:00.115 . Memory (MB): peak = 1822.742 ; gain = 0.000
Opt_design Change Summary
=========================


-------------------------------------------------------------------------------------------------------------------------
|  Phase                        |  #Cells created  |  #Cells Removed  |  #Constrained objects preventing optimizations  |
-------------------------------------------------------------------------------------------------------------------------
|  Retarget                     |               0  |               1  |                                              0  |
|  Constant propagation         |               0  |               0  |                                              0  |
|  Sweep                        |               0  |               0  |                                              0  |
|  BUFG optimization            |               0  |               0  |                                              0  |
|  Shift Register Optimization  |               0  |               0  |                                              0  |
|  Post Processing Netlist      |               0  |               0  |                                              0  |
-------------------------------------------------------------------------------------------------------------------------


Ending Logic Optimization Task | Checksum: 24ddadb18

Time (s): cpu = 00:00:00 ; elapsed = 00:00:00.116 . Memory (MB): peak = 1822.742 ; gain = 0.000

Starting Power Optimization Task
INFO: [Pwropt 34-132] Skipping clock gating for clocks with a period < 2.00 ns.
Ending Power Optimization Task | Checksum: 24ddadb18

Time (s): cpu = 00:00:00 ; elapsed = 00:00:00.010 . Memory (MB): peak = 1822.742 ; gain = 0.000

Starting Final Cleanup Task
Ending Final Cleanup Task | Checksum: 24ddadb18

Time (s): cpu = 00:00:00 ; elapsed = 00:00:00.001 . Memory (MB): peak = 1822.742 ; gain = 0.000

Starting Netlist Obfuscation Task
Netlist sorting complete. Time (s): cpu = 00:00:00 ; elapsed = 00:00:00 . Memory (MB): peak = 1822.742 ; gain = 0.000
Ending Netlist Obfuscation Task | Checksum: 24ddadb18

Time (s): cpu = 00:00:00 ; elapsed = 00:00:00 . Memory (MB): peak = 1822.742 ; gain = 0.000
INFO: [Common 17-83] Releasing license: Implementation
28 Infos, 21 Warnings, 21 Critical Warnings and 0 Errors encountered.
opt_design completed successfully
opt_design: Time (s): cpu = 00:00:08 ; elapsed = 00:00:08 . Memory (MB): peak = 1822.742 ; gain = 991.852
INFO: [Vivado 12-24828] Executing command : report_drc -file UART_Loopback_Top_drc_opted.rpt -pb UART_Loopback_Top_drc_opted.pb -rpx UART_Loopback_Top_drc_opted.rpx
Command: report_drc -file UART_Loopback_Top_drc_opted.rpt -pb UART_Loopback_Top_drc_opted.pb -rpx UART_Loopback_Top_drc_opted.rpx
INFO: [IP_Flow 19-234] Refreshing IP repositories
INFO: [IP_Flow 19-1704] No user IP repositories specified
INFO: [IP_Flow 19-2313] Loaded Vivado IP repository 'D:/Xilinx/Vivado/2024.2/data/ip'.
INFO: [DRC 23-27] Running DRC with 2 threads
INFO: [Vivado_Tcl 2-168] The results of DRC are in file D:/Downloads/project_BLE/project_BLE.runs/impl_1/UART_Loopback_Top_drc_opted.rpt.
report_drc completed successfully
Write ShapeDB Complete: Time (s): cpu = 00:00:00 ; elapsed = 00:00:00.002 . Memory (MB): peak = 1822.742 ; gain = 0.000
INFO: [Timing 38-480] Writing timing data to binary archive.
Wrote PlaceDB: Time (s): cpu = 00:00:00 ; elapsed = 00:00:00.001 . Memory (MB): peak = 1822.742 ; gain = 0.000
Wrote PulsedLatchDB: Time (s): cpu = 00:00:00 ; elapsed = 00:00:00 . Memory (MB): peak = 1822.742 ; gain = 0.000
Writing XDEF routing.
Writing XDEF routing logical nets.
Writing XDEF routing special nets.
Wrote RouteStorage: Time (s): cpu = 00:00:00 ; elapsed = 00:00:00.014 . Memory (MB): peak = 1822.742 ; gain = 0.000
Wrote Netlist Cache: Time (s): cpu = 00:00:00 ; elapsed = 00:00:00 . Memory (MB): peak = 1822.742 ; gain = 0.000
Wrote Device Cache: Time (s): cpu = 00:00:00 ; elapsed = 00:00:00.005 . Memory (MB): peak = 1822.742 ; gain = 0.000
Write Physdb Complete: Time (s): cpu = 00:00:00 ; elapsed = 00:00:00.029 . Memory (MB): peak = 1822.742 ; gain = 0.000
INFO: [Common 17-1381] The checkpoint 'D:/Downloads/project_BLE/project_BLE.runs/impl_1/UART_Loopback_Top_opt.dcp' has been generated.
Command: place_design
Attempting to get a license for feature 'Implementation' and/or device 'xc7a100t'
INFO: [Common 17-349] Got license for feature 'Implementation' and/or device 'xc7a100t'
INFO: [Common 17-83] Releasing license: Implementation
INFO: [DRC 23-27] Running DRC with 2 threads
INFO: [Vivado_Tcl 4-198] DRC finished with 0 Errors
INFO: [Vivado_Tcl 4-199] Please refer to the DRC report (report_drc) for more information.
Running DRC as a precondition to command place_design
INFO: [DRC 23-27] Running DRC with 2 threads
INFO: [Vivado_Tcl 4-198] DRC finished with 0 Errors
INFO: [Vivado_Tcl 4-199] Please refer to the DRC report (report_drc) for more information.
INFO: [Place 30-611] Multithreading enabled for place_design using a maximum of 2 CPUs

Starting Placer Task

Phase 1 Placer Initialization

Phase 1.1 Placer Initialization Netlist Sorting
Netlist sorting complete. Time (s): cpu = 00:00:00 ; elapsed = 00:00:00.001 . Memory (MB): peak = 1822.742 ; gain = 0.000
Phase 1.1 Placer Initialization Netlist Sorting | Checksum: 1f3148986

Time (s): cpu = 00:00:00 ; elapsed = 00:00:00.005 . Memory (MB): peak = 1822.742 ; gain = 0.000
Netlist sorting complete. Time (s): cpu = 00:00:00 ; elapsed = 00:00:00 . Memory (MB): peak = 1822.742 ; gain = 0.000

Phase 1.2 IO Placement/ Clock Placement/ Build Placer Device
INFO: [Timing 38-35] Done setting XDC timing constraints.
Phase 1.2 IO Placement/ Clock Placement/ Build Placer Device | Checksum: 19c92e700

Time (s): cpu = 00:00:00 ; elapsed = 00:00:00.252 . Memory (MB): peak = 1822.742 ; gain = 0.000

Phase 1.3 Build Placer Netlist Model
Phase 1.3 Build Placer Netlist Model | Checksum: 23057cbfd

Time (s): cpu = 00:00:00 ; elapsed = 00:00:00.459 . Memory (MB): peak = 1822.742 ; gain = 0.000

Phase 1.4 Constrain Clocks/Macros
Phase 1.4 Constrain Clocks/Macros | Checksum: 23057cbfd

Time (s): cpu = 00:00:00 ; elapsed = 00:00:00.464 . Memory (MB): peak = 1822.742 ; gain = 0.000
Phase 1 Placer Initialization | Checksum: 23057cbfd

Time (s): cpu = 00:00:00 ; elapsed = 00:00:00.477 . Memory (MB): peak = 1822.742 ; gain = 0.000

Phase 2 Global Placement

Phase 2.1 Floorplanning
Phase 2.1 Floorplanning | Checksum: 2997eaff4

Time (s): cpu = 00:00:00 ; elapsed = 00:00:00.571 . Memory (MB): peak = 1822.742 ; gain = 0.000

Phase 2.2 Update Timing before SLR Path Opt
Phase 2.2 Update Timing before SLR Path Opt | Checksum: 1b8cb83eb

Time (s): cpu = 00:00:00 ; elapsed = 00:00:00.630 . Memory (MB): peak = 1822.742 ; gain = 0.000

Phase 2.3 Post-Processing in Floorplanning
Phase 2.3 Post-Processing in Floorplanning | Checksum: 1b8cb83eb

Time (s): cpu = 00:00:00 ; elapsed = 00:00:00.633 . Memory (MB): peak = 1822.742 ; gain = 0.000

Phase 2.4 Global Place Phase1
Phase 2.4 Global Place Phase1 | Checksum: 1d2302171

Time (s): cpu = 00:00:02 ; elapsed = 00:00:02 . Memory (MB): peak = 1822.742 ; gain = 0.000

Phase 2.5 Global Place Phase2

Phase 2.5.1 UpdateTiming Before Physical Synthesis
Phase 2.5.1 UpdateTiming Before Physical Synthesis | Checksum: 1d2302171

Time (s): cpu = 00:00:02 ; elapsed = 00:00:02 . Memory (MB): peak = 1822.742 ; gain = 0.000

Phase 2.5.2 Physical Synthesis In Placer
INFO: [Physopt 32-1035] Found 0 LUTNM shape to break, 18 LUT instances to create LUTNM shape
INFO: [Physopt 32-1044] Break lutnm for timing: one critical 0, two critical 0, total 0, new lutff created 0
INFO: [Physopt 32-1138] End 1 Pass. Optimized 8 nets or LUTs. Breaked 0 LUT, combined 8 existing LUTs and moved 0 existing LUT
INFO: [Physopt 32-65] No nets found for high-fanout optimization.
INFO: [Physopt 32-232] Optimized 0 net. Created 0 new instance.
INFO: [Physopt 32-775] End 1 Pass. Optimized 0 net or cell. Created 0 new cell, deleted 0 existing cell and moved 0 existing cell
INFO: [Physopt 32-670] No setup violation found.  DSP Register Optimization was not performed.
INFO: [Physopt 32-670] No setup violation found.  Shift Register to Pipeline Optimization was not performed.
INFO: [Physopt 32-670] No setup violation found.  Shift Register Optimization was not performed.
INFO: [Physopt 32-670] No setup violation found.  BRAM Register Optimization was not performed.
INFO: [Physopt 32-670] No setup violation found.  URAM Register Optimization was not performed.
INFO: [Physopt 32-949] No candidate nets found for dynamic/static region interface net replication
INFO: [Physopt 32-775] End 1 Pass. Optimized 0 net or cell. Created 0 new cell, deleted 0 existing cell and moved 0 existing cell
Netlist sorting complete. Time (s): cpu = 00:00:00 ; elapsed = 00:00:00.001 . Memory (MB): peak = 1822.742 ; gain = 0.000

Summary of Physical Synthesis Optimizations
============================================


-----------------------------------------------------------------------------------------------------------------------------------------------------------
|  Optimization                                     |  Added Cells  |  Removed Cells  |  Optimized Cells/Nets  |  Dont Touch  |  Iterations  |  Elapsed   |
-----------------------------------------------------------------------------------------------------------------------------------------------------------
|  LUT Combining                                    |            0  |              8  |                     8  |           0  |           1  |  00:00:00  |
|  Retime                                           |            0  |              0  |                     0  |           0  |           1  |  00:00:00  |
|  Very High Fanout                                 |            0  |              0  |                     0  |           0  |           1  |  00:00:00  |
|  DSP Register                                     |            0  |              0  |                     0  |           0  |           0  |  00:00:00  |
|  Shift Register to Pipeline                       |            0  |              0  |                     0  |           0  |           0  |  00:00:00  |
|  Shift Register                                   |            0  |              0  |                     0  |           0  |           0  |  00:00:00  |
|  BRAM Register                                    |            0  |              0  |                     0  |           0  |           0  |  00:00:00  |
|  URAM Register                                    |            0  |              0  |                     0  |           0  |           0  |  00:00:00  |
|  Dynamic/Static Region Interface Net Replication  |            0  |              0  |                     0  |           0  |           1  |  00:00:00  |
|  Total                                            |            0  |              8  |                     8  |           0  |           4  |  00:00:00  |
-----------------------------------------------------------------------------------------------------------------------------------------------------------


Phase 2.5.2 Physical Synthesis In Placer | Checksum: 257b6dfb5

Time (s): cpu = 00:00:02 ; elapsed = 00:00:02 . Memory (MB): peak = 1822.742 ; gain = 0.000
Phase 2.5 Global Place Phase2 | Checksum: 2300276c3

Time (s): cpu = 00:00:02 ; elapsed = 00:00:02 . Memory (MB): peak = 1822.742 ; gain = 0.000
Phase 2 Global Placement | Checksum: 2300276c3

Time (s): cpu = 00:00:02 ; elapsed = 00:00:02 . Memory (MB): peak = 1822.742 ; gain = 0.000

Phase 3 Detail Placement

Phase 3.1 Commit Multi Column Macros
Phase 3.1 Commit Multi Column Macros | Checksum: 2435c7099

Time (s): cpu = 00:00:02 ; elapsed = 00:00:02 . Memory (MB): peak = 1822.742 ; gain = 0.000

Phase 3.2 Commit Most Macros & LUTRAMs
Phase 3.2 Commit Most Macros & LUTRAMs | Checksum: 1d8b007d5

Time (s): cpu = 00:00:02 ; elapsed = 00:00:02 . Memory (MB): peak = 1822.742 ; gain = 0.000

Phase 3.3 Area Swap Optimization
Phase 3.3 Area Swap Optimization | Checksum: 2759cc537

Time (s): cpu = 00:00:02 ; elapsed = 00:00:02 . Memory (MB): peak = 1822.742 ; gain = 0.000

Phase 3.4 Pipeline Register Optimization
Phase 3.4 Pipeline Register Optimization | Checksum: 2372d0d92

Time (s): cpu = 00:00:02 ; elapsed = 00:00:02 . Memory (MB): peak = 1822.742 ; gain = 0.000

Phase 3.5 Small Shape Detail Placement
Phase 3.5 Small Shape Detail Placement | Checksum: 24c390a63

Time (s): cpu = 00:00:02 ; elapsed = 00:00:02 . Memory (MB): peak = 1822.742 ; gain = 0.000

Phase 3.6 Re-assign LUT pins
Phase 3.6 Re-assign LUT pins | Checksum: 1d49f84b8

Time (s): cpu = 00:00:02 ; elapsed = 00:00:02 . Memory (MB): peak = 1822.742 ; gain = 0.000

Phase 3.7 Pipeline Register Optimization
Phase 3.7 Pipeline Register Optimization | Checksum: 213103c4b

Time (s): cpu = 00:00:02 ; elapsed = 00:00:02 . Memory (MB): peak = 1822.742 ; gain = 0.000
Phase 3 Detail Placement | Checksum: 213103c4b

Time (s): cpu = 00:00:02 ; elapsed = 00:00:02 . Memory (MB): peak = 1822.742 ; gain = 0.000

Phase 4 Post Placement Optimization and Clean-Up

Phase 4.1 Post Commit Optimization
INFO: [Timing 38-35] Done setting XDC timing constraints.

Phase 4.1.1 Post Placement Optimization
Post Placement Optimization Initialization | Checksum: 1d83d0f37

Phase 4.1.1.1 BUFG Insertion

Starting Physical Synthesis Task

Phase 1 Physical Synthesis Initialization
INFO: [Physopt 32-721] Multithreading enabled for phys_opt_design using a maximum of 2 CPUs
INFO: [Physopt 32-619] Estimated Timing Summary | WNS=3.203 | TNS=0.000 |
Phase 1 Physical Synthesis Initialization | Checksum: 110533180

Time (s): cpu = 00:00:00 ; elapsed = 00:00:00.016 . Memory (MB): peak = 1822.742 ; gain = 0.000
INFO: [Place 46-56] BUFG insertion identified 0 candidate nets. Inserted BUFG: 0, Replicated BUFG Driver: 0, Skipped due to Placement/Routing Conflicts: 0, Skipped due to Timing Degradation: 0, Skipped due to netlist editing failed: 0.
Ending Physical Synthesis Task | Checksum: 1f67cb339

Time (s): cpu = 00:00:00 ; elapsed = 00:00:00.020 . Memory (MB): peak = 1822.742 ; gain = 0.000
Phase 4.1.1.1 BUFG Insertion | Checksum: 1d83d0f37

Time (s): cpu = 00:00:02 ; elapsed = 00:00:02 . Memory (MB): peak = 1822.742 ; gain = 0.000

Phase 4.1.1.2 Post Placement Timing Optimization
INFO: [Place 30-746] Post Placement Timing Summary WNS=3.203. For the most accurate timing information please run report_timing.
Phase 4.1.1.2 Post Placement Timing Optimization | Checksum: 1c46bb003

Time (s): cpu = 00:00:02 ; elapsed = 00:00:02 . Memory (MB): peak = 1822.742 ; gain = 0.000

Time (s): cpu = 00:00:02 ; elapsed = 00:00:03 . Memory (MB): peak = 1822.742 ; gain = 0.000
Phase 4.1 Post Commit Optimization | Checksum: 1c46bb003

Time (s): cpu = 00:00:02 ; elapsed = 00:00:03 . Memory (MB): peak = 1822.742 ; gain = 0.000

Phase 4.2 Post Placement Cleanup
Phase 4.2 Post Placement Cleanup | Checksum: 1c46bb003

Time (s): cpu = 00:00:02 ; elapsed = 00:00:03 . Memory (MB): peak = 1822.742 ; gain = 0.000

Phase 4.3 Placer Reporting

Phase 4.3.1 Print Estimated Congestion
INFO: [Place 30-612] Post-Placement Estimated Congestion 
 ____________________________________________________
|           | Global Congestion | Short Congestion  |
| Direction | Region Size       | Region Size       |
|___________|___________________|___________________|
|      North|                1x1|                1x1|
|___________|___________________|___________________|
|      South|                1x1|                1x1|
|___________|___________________|___________________|
|       East|                1x1|                1x1|
|___________|___________________|___________________|
|       West|                1x1|                1x1|
|___________|___________________|___________________|

Phase 4.3.1 Print Estimated Congestion | Checksum: 1c46bb003

Time (s): cpu = 00:00:02 ; elapsed = 00:00:03 . Memory (MB): peak = 1822.742 ; gain = 0.000
Phase 4.3 Placer Reporting | Checksum: 1c46bb003

Time (s): cpu = 00:00:02 ; elapsed = 00:00:03 . Memory (MB): peak = 1822.742 ; gain = 0.000

Phase 4.4 Final Placement Cleanup
Netlist sorting complete. Time (s): cpu = 00:00:00 ; elapsed = 00:00:00 . Memory (MB): peak = 1822.742 ; gain = 0.000

Time (s): cpu = 00:00:02 ; elapsed = 00:00:03 . Memory (MB): peak = 1822.742 ; gain = 0.000
Phase 4 Post Placement Optimization and Clean-Up | Checksum: 2326f672e

Time (s): cpu = 00:00:02 ; elapsed = 00:00:03 . Memory (MB): peak = 1822.742 ; gain = 0.000
Ending Placer Task | Checksum: 209ba18d2

Time (s): cpu = 00:00:02 ; elapsed = 00:00:03 . Memory (MB): peak = 1822.742 ; gain = 0.000
65 Infos, 21 Warnings, 21 Critical Warnings and 0 Errors encountered.
place_design completed successfully
INFO: [Vivado 12-24838] Running report commands "report_control_sets, report_io, report_utilization" in parallel.
Running report generation with 2 threads.
INFO: [Vivado 12-24828] Executing command : report_utilization -file UART_Loopback_Top_utilization_placed.rpt -pb UART_Loopback_Top_utilization_placed.pb
INFO: [Vivado 12-24828] Executing command : report_io -file UART_Loopback_Top_io_placed.rpt
report_io: Time (s): cpu = 00:00:00 ; elapsed = 00:00:00.027 . Memory (MB): peak = 1822.742 ; gain = 0.000
INFO: [Vivado 12-24828] Executing command : report_control_sets -verbose -file UART_Loopback_Top_control_sets_placed.rpt
report_control_sets: Time (s): cpu = 00:00:00 ; elapsed = 00:00:00.023 . Memory (MB): peak = 1822.742 ; gain = 0.000
Write ShapeDB Complete: Time (s): cpu = 00:00:00 ; elapsed = 00:00:00.002 . Memory (MB): peak = 1822.742 ; gain = 0.000
INFO: [Timing 38-480] Writing timing data to binary archive.
Wrote PlaceDB: Time (s): cpu = 00:00:00 ; elapsed = 00:00:00.024 . Memory (MB): peak = 1822.742 ; gain = 0.000
Wrote PulsedLatchDB: Time (s): cpu = 00:00:00 ; elapsed = 00:00:00 . Memory (MB): peak = 1822.742 ; gain = 0.000
Writing XDEF routing.
Writing XDEF routing logical nets.
Writing XDEF routing special nets.
Wrote RouteStorage: Time (s): cpu = 00:00:00 ; elapsed = 00:00:00.012 . Memory (MB): peak = 1822.742 ; gain = 0.000
Wrote Netlist Cache: Time (s): cpu = 00:00:00 ; elapsed = 00:00:00.001 . Memory (MB): peak = 1822.742 ; gain = 0.000
Wrote Device Cache: Time (s): cpu = 00:00:00 ; elapsed = 00:00:00.006 . Memory (MB): peak = 1822.742 ; gain = 0.000
Write Physdb Complete: Time (s): cpu = 00:00:00 ; elapsed = 00:00:00.049 . Memory (MB): peak = 1822.742 ; gain = 0.000
INFO: [Common 17-1381] The checkpoint 'D:/Downloads/project_BLE/project_BLE.runs/impl_1/UART_Loopback_Top_placed.dcp' has been generated.
Command: phys_opt_design
Attempting to get a license for feature 'Implementation' and/or device 'xc7a100t'
INFO: [Common 17-349] Got license for feature 'Implementation' and/or device 'xc7a100t'

Starting Initial Update Timing Task

Time (s): cpu = 00:00:00 ; elapsed = 00:00:00.047 . Memory (MB): peak = 1830.746 ; gain = 8.004
INFO: [Vivado_Tcl 4-2279] Estimated Timing Summary | WNS= 3.203 | TNS= 0.000 | 
INFO: [Vivado_Tcl 4-383] Design worst setup slack (WNS) is greater than or equal to 0.000 ns. All physical synthesis setup optimizations will be skipped.
INFO: [Vivado_Tcl 4-232] No setup violation found. The netlist was not modified.
INFO: [Common 17-83] Releasing license: Implementation
76 Infos, 21 Warnings, 21 Critical Warnings and 0 Errors encountered.
phys_opt_design completed successfully
Write ShapeDB Complete: Time (s): cpu = 00:00:00 ; elapsed = 00:00:00.003 . Memory (MB): peak = 1848.621 ; gain = 0.000
INFO: [Timing 38-480] Writing timing data to binary archive.
Wrote PlaceDB: Time (s): cpu = 00:00:00 ; elapsed = 00:00:00.034 . Memory (MB): peak = 1848.621 ; gain = 0.000
Wrote PulsedLatchDB: Time (s): cpu = 00:00:00 ; elapsed = 00:00:00 . Memory (MB): peak = 1848.621 ; gain = 0.000
Writing XDEF routing.
Writing XDEF routing logical nets.
Writing XDEF routing special nets.
Wrote RouteStorage: Time (s): cpu = 00:00:00 ; elapsed = 00:00:00.013 . Memory (MB): peak = 1848.621 ; gain = 0.000
Wrote Netlist Cache: Time (s): cpu = 00:00:00 ; elapsed = 00:00:00.001 . Memory (MB): peak = 1848.621 ; gain = 0.000
Wrote Device Cache: Time (s): cpu = 00:00:00 ; elapsed = 00:00:00.006 . Memory (MB): peak = 1848.621 ; gain = 0.000
Write Physdb Complete: Time (s): cpu = 00:00:00 ; elapsed = 00:00:00.062 . Memory (MB): peak = 1848.621 ; gain = 0.000
INFO: [Common 17-1381] The checkpoint 'D:/Downloads/project_BLE/project_BLE.runs/impl_1/UART_Loopback_Top_physopt.dcp' has been generated.
Command: route_design
Attempting to get a license for feature 'Implementation' and/or device 'xc7a100t'
INFO: [Common 17-349] Got license for feature 'Implementation' and/or device 'xc7a100t'


Starting Routing Task
INFO: [Route 35-254] Multithreading enabled for route_design using a maximum of 2 CPUs

Phase 1 Build RT Design
Checksum: PlaceDB: 70ddcfb3 ConstDB: 0 ShapeSum: e709e989 RouteDB: b1d25f96
Post Restoration Checksum: NetGraph: 5c87b263 | NumContArr: fdfe9ef0 | Constraints: c2a8fa9d | Timing: c2a8fa9d
Phase 1 Build RT Design | Checksum: 2dfd8468d

Time (s): cpu = 00:00:23 ; elapsed = 00:00:20 . Memory (MB): peak = 1967.840 ; gain = 119.203

Phase 2 Router Initialization

Phase 2.1 Fix Topology Constraints
Phase 2.1 Fix Topology Constraints | Checksum: 2dfd8468d

Time (s): cpu = 00:00:23 ; elapsed = 00:00:20 . Memory (MB): peak = 1967.840 ; gain = 119.203

Phase 2.2 Pre Route Cleanup
Phase 2.2 Pre Route Cleanup | Checksum: 2dfd8468d

Time (s): cpu = 00:00:23 ; elapsed = 00:00:20 . Memory (MB): peak = 1967.840 ; gain = 119.203
 Number of Nodes with overlaps = 0

Phase 2.3 Update Timing
Phase 2.3 Update Timing | Checksum: 28c4ef64a

Time (s): cpu = 00:00:23 ; elapsed = 00:00:21 . Memory (MB): peak = 2007.961 ; gain = 159.324
INFO: [Route 35-416] Intermediate Timing Summary | WNS=3.276  | TNS=0.000  | WHS=-0.145 | THS=-4.875 |


Router Utilization Summary
  Global Vertical Routing Utilization    = 0 %
  Global Horizontal Routing Utilization  = 0 %
  Routable Net Status*
  *Does not include unroutable nets such as driverless and loadless.
  Run report_route_status for detailed report.
  Number of Failed Nets               = 460
    (Failed Nets is the sum of unrouted and partially routed nets)
  Number of Unrouted Nets             = 460
  Number of Partially Routed Nets     = 0
  Number of Node Overlaps             = 0

Phase 2 Router Initialization | Checksum: 22f34c976

Time (s): cpu = 00:00:24 ; elapsed = 00:00:21 . Memory (MB): peak = 2007.961 ; gain = 159.324

Phase 3 Global Routing
Phase 3 Global Routing | Checksum: 22f34c976

Time (s): cpu = 00:00:24 ; elapsed = 00:00:21 . Memory (MB): peak = 2007.961 ; gain = 159.324

Phase 4 Initial Routing

Phase 4.1 Initial Net Routing Pass
Phase 4.1 Initial Net Routing Pass | Checksum: 1f5e11ff8

Time (s): cpu = 00:00:24 ; elapsed = 00:00:21 . Memory (MB): peak = 2007.961 ; gain = 159.324
Phase 4 Initial Routing | Checksum: 1f5e11ff8

Time (s): cpu = 00:00:24 ; elapsed = 00:00:21 . Memory (MB): peak = 2007.961 ; gain = 159.324

Phase 5 Rip-up And Reroute

Phase 5.1 Global Iteration 0
 Number of Nodes with overlaps = 54
 Number of Nodes with overlaps = 4
 Number of Nodes with overlaps = 0
INFO: [Route 35-416] Intermediate Timing Summary | WNS=3.826  | TNS=0.000  | WHS=N/A    | THS=N/A    |

Phase 5.1 Global Iteration 0 | Checksum: 28bade5d4

Time (s): cpu = 00:00:24 ; elapsed = 00:00:21 . Memory (MB): peak = 2007.961 ; gain = 159.324
Phase 5 Rip-up And Reroute | Checksum: 28bade5d4

Time (s): cpu = 00:00:24 ; elapsed = 00:00:21 . Memory (MB): peak = 2007.961 ; gain = 159.324

Phase 6 Delay and Skew Optimization

Phase 6.1 Delay CleanUp

Phase 6.1.1 Update Timing
Phase 6.1.1 Update Timing | Checksum: 3611bc08c

Time (s): cpu = 00:00:24 ; elapsed = 00:00:21 . Memory (MB): peak = 2007.961 ; gain = 159.324
INFO: [Route 35-416] Intermediate Timing Summary | WNS=3.826  | TNS=0.000  | WHS=N/A    | THS=N/A    |

Phase 6.1 Delay CleanUp | Checksum: 3611bc08c

Time (s): cpu = 00:00:24 ; elapsed = 00:00:21 . Memory (MB): peak = 2007.961 ; gain = 159.324

Phase 6.2 Clock Skew Optimization
Phase 6.2 Clock Skew Optimization | Checksum: 3611bc08c

Time (s): cpu = 00:00:24 ; elapsed = 00:00:21 . Memory (MB): peak = 2007.961 ; gain = 159.324
Phase 6 Delay and Skew Optimization | Checksum: 3611bc08c

Time (s): cpu = 00:00:24 ; elapsed = 00:00:21 . Memory (MB): peak = 2007.961 ; gain = 159.324

Phase 7 Post Hold Fix

Phase 7.1 Hold Fix Iter
INFO: [Route 35-416] Intermediate Timing Summary | WNS=3.826  | TNS=0.000  | WHS=0.103  | THS=0.000  |

Phase 7.1 Hold Fix Iter | Checksum: 2b3663506

Time (s): cpu = 00:00:24 ; elapsed = 00:00:21 . Memory (MB): peak = 2007.961 ; gain = 159.324
Phase 7 Post Hold Fix | Checksum: 2b3663506

Time (s): cpu = 00:00:24 ; elapsed = 00:00:21 . Memory (MB): peak = 2007.961 ; gain = 159.324

Phase 8 Route finalize

Router Utilization Summary
  Global Vertical Routing Utilization    = 0.0413022 %
  Global Horizontal Routing Utilization  = 0.0520034 %
  Routable Net Status*
  *Does not include unroutable nets such as driverless and loadless.
  Run report_route_status for detailed report.
  Number of Failed Nets               = 0
    (Failed Nets is the sum of unrouted and partially routed nets)
  Number of Unrouted Nets             = 0
  Number of Partially Routed Nets     = 0
  Number of Node Overlaps             = 0

Phase 8 Route finalize | Checksum: 2b3663506

Time (s): cpu = 00:00:24 ; elapsed = 00:00:21 . Memory (MB): peak = 2007.961 ; gain = 159.324

Phase 9 Verifying routed nets

 Verification completed successfully
Phase 9 Verifying routed nets | Checksum: 2b3663506

Time (s): cpu = 00:00:24 ; elapsed = 00:00:21 . Memory (MB): peak = 2007.961 ; gain = 159.324

Phase 10 Depositing Routes
Phase 10 Depositing Routes | Checksum: 29ead85d7

Time (s): cpu = 00:00:24 ; elapsed = 00:00:21 . Memory (MB): peak = 2007.961 ; gain = 159.324

Phase 11 Post Process Routing
Phase 11 Post Process Routing | Checksum: 29ead85d7

Time (s): cpu = 00:00:24 ; elapsed = 00:00:21 . Memory (MB): peak = 2007.961 ; gain = 159.324

Phase 12 Post Router Timing
INFO: [Route 35-57] Estimated Timing Summary | WNS=3.826  | TNS=0.000  | WHS=0.103  | THS=0.000  |

INFO: [Route 35-327] The final timing numbers are based on the router estimated timing analysis. For a complete and accurate timing signoff, please run report_timing_summary.
Phase 12 Post Router Timing | Checksum: 29ead85d7

Time (s): cpu = 00:00:24 ; elapsed = 00:00:21 . Memory (MB): peak = 2007.961 ; gain = 159.324
Total Elapsed time in route_design: 21.348 secs

Phase 13 Post-Route Event Processing
Phase 13 Post-Route Event Processing | Checksum: 214630b9a

Time (s): cpu = 00:00:24 ; elapsed = 00:00:21 . Memory (MB): peak = 2007.961 ; gain = 159.324
INFO: [Route 35-16] Router Completed Successfully
Ending Routing Task | Checksum: 214630b9a

Time (s): cpu = 00:00:24 ; elapsed = 00:00:21 . Memory (MB): peak = 2007.961 ; gain = 159.324

Routing Is Done.
INFO: [Common 17-83] Releasing license: Implementation
88 Infos, 21 Warnings, 21 Critical Warnings and 0 Errors encountered.
route_design completed successfully
route_design: Time (s): cpu = 00:00:24 ; elapsed = 00:00:21 . Memory (MB): peak = 2007.961 ; gain = 159.340
INFO: [Vivado 12-24828] Executing command : report_drc -file UART_Loopback_Top_drc_routed.rpt -pb UART_Loopback_Top_drc_routed.pb -rpx UART_Loopback_Top_drc_routed.rpx
Command: report_drc -file UART_Loopback_Top_drc_routed.rpt -pb UART_Loopback_Top_drc_routed.pb -rpx UART_Loopback_Top_drc_routed.rpx
INFO: [IP_Flow 19-1839] IP Catalog is up to date.
INFO: [DRC 23-27] Running DRC with 2 threads
INFO: [Vivado_Tcl 2-168] The results of DRC are in file D:/Downloads/project_BLE/project_BLE.runs/impl_1/UART_Loopback_Top_drc_routed.rpt.
report_drc completed successfully
INFO: [Vivado 12-24828] Executing command : report_methodology -file UART_Loopback_Top_methodology_drc_routed.rpt -pb UART_Loopback_Top_methodology_drc_routed.pb -rpx UART_Loopback_Top_methodology_drc_routed.rpx
Command: report_methodology -file UART_Loopback_Top_methodology_drc_routed.rpt -pb UART_Loopback_Top_methodology_drc_routed.pb -rpx UART_Loopback_Top_methodology_drc_routed.rpx
INFO: [Timing 38-35] Done setting XDC timing constraints.
INFO: [DRC 23-133] Running Methodology with 2 threads
INFO: [Vivado_Tcl 2-1520] The results of Report Methodology are in file D:/Downloads/project_BLE/project_BLE.runs/impl_1/UART_Loopback_Top_methodology_drc_routed.rpt.
report_methodology completed successfully
INFO: [Vivado 12-24828] Executing command : report_timing_summary -max_paths 10 -report_unconstrained -file UART_Loopback_Top_timing_summary_routed.rpt -pb UART_Loopback_Top_timing_summary_routed.pb -rpx UART_Loopback_Top_timing_summary_routed.rpx -warn_on_violation 
INFO: [Timing 38-35] Done setting XDC timing constraints.
INFO: [Timing 38-91] UpdateTimingParams: Speed grade: -1, Delay Type: min_max.
INFO: [Timing 38-191] Multithreading enabled for timing update using a maximum of 2 CPUs
INFO: [Vivado 12-24838] Running report commands "report_incremental_reuse, report_route_status" in parallel.
Running report generation with 2 threads.
INFO: [Vivado 12-24828] Executing command : report_route_status -file UART_Loopback_Top_route_status.rpt -pb UART_Loopback_Top_route_status.pb
INFO: [Vivado 12-24828] Executing command : report_incremental_reuse -file UART_Loopback_Top_incremental_reuse_routed.rpt
INFO: [Vivado_Tcl 4-1062] Incremental flow is disabled. No incremental reuse Info to report.
INFO: [Vivado 12-24828] Executing command : report_power -file UART_Loopback_Top_power_routed.rpt -pb UART_Loopback_Top_power_summary_routed.pb -rpx UART_Loopback_Top_power_routed.rpx
Command: report_power -file UART_Loopback_Top_power_routed.rpt -pb UART_Loopback_Top_power_summary_routed.pb -rpx UART_Loopback_Top_power_routed.rpx
Running Vector-less Activity Propagation...

Finished Running Vector-less Activity Propagation
105 Infos, 21 Warnings, 21 Critical Warnings and 0 Errors encountered.
report_power completed successfully
INFO: [Vivado 12-24828] Executing command : report_clock_utilization -file UART_Loopback_Top_clock_utilization_routed.rpt
INFO: [Vivado 12-24828] Executing command : report_bus_skew -warn_on_violation -file UART_Loopback_Top_bus_skew_routed.rpt -pb UART_Loopback_Top_bus_skew_routed.pb -rpx UART_Loopback_Top_bus_skew_routed.rpx
INFO: [Timing 38-91] UpdateTimingParams: Speed grade: -1, Delay Type: min_max.
INFO: [Timing 38-191] Multithreading enabled for timing update using a maximum of 2 CPUs
generate_parallel_reports: Time (s): cpu = 00:00:08 ; elapsed = 00:00:05 . Memory (MB): peak = 2065.535 ; gain = 57.574
Write ShapeDB Complete: Time (s): cpu = 00:00:00 ; elapsed = 00:00:00.003 . Memory (MB): peak = 2077.766 ; gain = 0.008
INFO: [Timing 38-480] Writing timing data to binary archive.
Wrote PlaceDB: Time (s): cpu = 00:00:00 ; elapsed = 00:00:00.027 . Memory (MB): peak = 2077.766 ; gain = 0.000
Wrote PulsedLatchDB: Time (s): cpu = 00:00:00 ; elapsed = 00:00:00 . Memory (MB): peak = 2077.766 ; gain = 0.000
Writing XDEF routing.
Writing XDEF routing logical nets.
Writing XDEF routing special nets.
Wrote RouteStorage: Time (s): cpu = 00:00:00 ; elapsed = 00:00:00.014 . Memory (MB): peak = 2077.766 ; gain = 0.000
Wrote Netlist Cache: Time (s): cpu = 00:00:00 ; elapsed = 00:00:00.001 . Memory (MB): peak = 2077.766 ; gain = 0.000
Wrote Device Cache: Time (s): cpu = 00:00:00 ; elapsed = 00:00:00.004 . Memory (MB): peak = 2077.766 ; gain = 0.000
Write Physdb Complete: Time (s): cpu = 00:00:00 ; elapsed = 00:00:00.056 . Memory (MB): peak = 2077.766 ; gain = 0.000
INFO: [Common 17-1381] The checkpoint 'D:/Downloads/project_BLE/project_BLE.runs/impl_1/UART_Loopback_Top_routed.dcp' has been generated.
Command: write_bitstream -force UART_Loopback_Top.bit
Attempting to get a license for feature 'Implementation' and/or device 'xc7a100t'
INFO: [Common 17-349] Got license for feature 'Implementation' and/or device 'xc7a100t'
Running DRC as a precondition to command write_bitstream
INFO: [IP_Flow 19-1839] IP Catalog is up to date.
INFO: [DRC 23-27] Running DRC with 2 threads
INFO: [Vivado 12-3199] DRC finished with 0 Errors
INFO: [Vivado 12-3200] Please refer to the DRC report (report_drc) for more information.
INFO: [Designutils 20-2272] Running write_bitstream with 2 threads.
Loading data files...
Loading site data...
Loading route data...
Processing options...
Creating bitmap...
Creating bitstream...
Writing bitstream ./UART_Loopback_Top.bit...
INFO: [Vivado 12-1842] Bitgen Completed Successfully.
INFO: [Project 1-1876] WebTalk data collection is mandatory when using a ULT device. To see the specific WebTalk data collected for your design, open the usage_statistics_webtalk.html or usage_statistics_webtalk.xml file in the implementation directory.
INFO: [Common 17-83] Releasing license: Implementation
120 Infos, 21 Warnings, 21 Critical Warnings and 0 Errors encountered.
write_bitstream completed successfully
write_bitstream: Time (s): cpu = 00:00:10 ; elapsed = 00:00:08 . Memory (MB): peak = 2589.195 ; gain = 511.430
INFO: [Common 17-206] Exiting Vivado at Sun Jan 18 15:57:51 2026...

*** Running vivado
    with args -log UART_Loopback_Top.vdi -applog -m64 -product Vivado -messageDb vivado.pb -mode batch -source UART_Loopback_Top.tcl -notrace



****** Vivado v2024.2 (64-bit)
  **** SW Build 5239630 on Fri Nov 08 22:35:27 MST 2024
  **** IP Build 5239520 on Sun Nov 10 16:12:51 MST 2024
  **** SharedData Build 5239561 on Fri Nov 08 14:39:27 MST 2024
  **** Start of session at: Sun Jan 18 15:58:41 2026
    ** Copyright 1986-2022 Xilinx, Inc. All Rights Reserved.
    ** Copyright 2022-2024 Advanced Micro Devices, Inc. All Rights Reserved.

source UART_Loopback_Top.tcl -notrace
Command: open_checkpoint UART_Loopback_Top_routed.dcp
INFO: [Device 21-403] Loading part xc7a100tcsg324-1
Netlist sorting complete. Time (s): cpu = 00:00:00 ; elapsed = 00:00:00.002 . Memory (MB): peak = 698.121 ; gain = 0.000
INFO: [Netlist 29-17] Analyzing 36 Unisim elements for replacement
INFO: [Netlist 29-28] Unisim Transformation completed in 0 CPU seconds
INFO: [Project 1-479] Netlist was created with Vivado 2024.2
INFO: [Project 1-570] Preparing netlist for logic optimization
Read ShapeDB Complete: Time (s): cpu = 00:00:00 ; elapsed = 00:00:00.003 . Memory (MB): peak = 787.973 ; gain = 0.137
INFO: [Timing 38-478] Restoring timing data from binary archive.
INFO: [Timing 38-479] Binary timing data restore complete.
INFO: [Project 1-856] Restoring constraints from binary archive.
INFO: [Project 1-853] Binary constraint restore complete.
INFO: [Designutils 20-5722] Start Reading Physical Databases.
Reading placement.
Read Netlist Cache: Time (s): cpu = 00:00:00 ; elapsed = 00:00:00.001 . Memory (MB): peak = 1406.613 ; gain = 0.000
Reading placer database...
Read Device Cache: Time (s): cpu = 00:00:00 ; elapsed = 00:00:00.004 . Memory (MB): peak = 1406.613 ; gain = 0.000
Read PlaceDB: Time (s): cpu = 00:00:00 ; elapsed = 00:00:00.014 . Memory (MB): peak = 1406.613 ; gain = 0.000
Read PulsedLatchDB: Time (s): cpu = 00:00:00 ; elapsed = 00:00:00 . Memory (MB): peak = 1406.613 ; gain = 0.000
Reading routing.
Read RouteStorage: Time (s): cpu = 00:00:00 ; elapsed = 00:00:00.009 . Memory (MB): peak = 1406.613 ; gain = 0.000
Read Physdb Files: Time (s): cpu = 00:00:00 ; elapsed = 00:00:00.038 . Memory (MB): peak = 1406.613 ; gain = 0.000
Restored from archive | CPU: 1.000000 secs | Memory: 0.000000 MB |
Finished XDEF File Restore: Time (s): cpu = 00:00:01 ; elapsed = 00:00:00.078 . Memory (MB): peak = 1406.613 ; gain = 8.656
Netlist sorting complete. Time (s): cpu = 00:00:00 ; elapsed = 00:00:00 . Memory (MB): peak = 1406.613 ; gain = 0.000
INFO: [Project 1-111] Unisim Transformation Summary:
  A total of 1 instances were transformed.
  IOBUF => IOBUF (IBUF, OBUFT): 1 instance 

INFO: [Project 1-604] Checkpoint was created with Vivado v2024.2 (64-bit) build 5239630
open_checkpoint: Time (s): cpu = 00:00:11 ; elapsed = 00:00:14 . Memory (MB): peak = 1406.613 ; gain = 1076.043
Command: write_bitstream -force UART_Loopback_Top.bit
Attempting to get a license for feature 'Implementation' and/or device 'xc7a100t'
INFO: [Common 17-349] Got license for feature 'Implementation' and/or device 'xc7a100t'
Running DRC as a precondition to command write_bitstream
INFO: [IP_Flow 19-234] Refreshing IP repositories
INFO: [IP_Flow 19-1704] No user IP repositories specified
INFO: [IP_Flow 19-2313] Loaded Vivado IP repository 'D:/Xilinx/Vivado/2024.2/data/ip'.
INFO: [DRC 23-27] Running DRC with 2 threads
INFO: [Vivado 12-3199] DRC finished with 0 Errors
INFO: [Vivado 12-3200] Please refer to the DRC report (report_drc) for more information.
INFO: [Designutils 20-2272] Running write_bitstream with 2 threads.
Loading data files...
Loading site data...
Loading route data...
Processing options...
Creating bitmap...
Creating bitstream...
Writing bitstream ./UART_Loopback_Top.bit...
INFO: [Vivado 12-1842] Bitgen Completed Successfully.
INFO: [Project 1-1876] WebTalk data collection is mandatory when using a ULT device. To see the specific WebTalk data collected for your design, open the usage_statistics_webtalk.html or usage_statistics_webtalk.xml file in the implementation directory.
INFO: [Common 17-83] Releasing license: Implementation
23 Infos, 0 Warnings, 0 Critical Warnings and 0 Errors encountered.
write_bitstream completed successfully
write_bitstream: Time (s): cpu = 00:00:10 ; elapsed = 00:00:09 . Memory (MB): peak = 1988.312 ; gain = 581.699
INFO: [Common 17-206] Exiting Vivado at Sun Jan 18 15:59:09 2026...
